{
  "level": "P1",
  "platform": [
    "shared"
  ],
  "gate": {
    "kind": "unit",
    "file": "shared/rust-core/src/db/storage.rs",
    "test": "quota_eviction_measures_the_storage_tree_once_per_reserve",
    "command": "cargo test --locked --manifest-path shared/rust-core/Cargo.toml",
    "asserts": "登记门禁为淘汰侧：多次驱逐时整棵树只被测量一次（计数器为 1），且退出时配额成立。同一事项另有三组已执行测试：quota_eviction_credits_the_wal_the_delete_reclaims（WAL 抵扣）、the_admission_lock_is_held_while_the_batch_state_is_read（锁覆盖）、file_batch_admission_waits_for_the_shared_admission_lock 与 a_second_batch_cannot_claim_space_reserved_by_the_first（准入串行与记账）。"
  },
  "ci_job": [
    "rust-macos",
    "rust-windows"
  ],
  "native_acceptance": null,
  "last_verified_main_sha": "b61a0a04b88f5828707f7ef64781389944471be8",
  "id": "S4-P1-3",
  "title": "配额淘汰不再逐条递归全盘扫描并长期持锁",
  "code_symbols": [
    "shared/rust-core/src/db/storage.rs:reserve_for_file_batch"
  ],
  "trigger": "淘汰循环每次删除都在 DB 互斥锁内递归扫描整个存储目录。",
  "fix_evidence": "删除路径（delete_entries_with_batch_policy 及其包装）回报\"可证明释放的外部载荷字节数\"；reserve_for_file_batch 先测一次物理基线，之后每次淘汰扣减\"载荷字节 + db/wal/shm 三件文件的净变化\"（删除会截断 WAL 但也会让 DB 增长，只抵扣载荷或只抵扣 WAL 都会让 used 低估、循环在超配额处退出）；净变化为负或抵扣<=0 时回退重测。门禁：quota_eviction_measures_the_storage_tree_once_per_reserve（多次驱逐下整树只测一次 + 配额合规）与 quota_eviction_credits_the_wal_the_delete_reclaims（含合规断言）。已**分别**执行三次变异（只抵扣载荷 / 抵扣加倍 / 巨额过度抵扣），三者均使门禁失败。**未完成**：方案要求的\"并发双批次证明不会重复认领空间\"测试尚未编写（准入由共享层 file_batch_admission_lock 串行化，需在平台层补测），因此本项保持 partial 而非 fixed。 并发准入门禁（2026-09-30）：把准入临界区从 handle_accepted_connection_inner 抽成 admit_incoming_file_batch（返回 Admitted/Rejected，并保留原块中两处 `?` 的\"中止会话\"语义），使生产路径可被测试。两个确定性门禁已做变异验证（删锁 / 忽略 pending 抵扣均失败）。注：初版用\"两个任务竞速\"的测试对锁不敏感、且在全量并行下抖动，已废弃；现版本改用持锁确认 + 单一模块级存储目录锁。 并发准入（2026-09-30）：准入临界区抽成 admit_incoming_file_batch（语义逐行核对与抽取前一致，含两处 `?` 仍中止会话），并加两个确定性门禁——\"准入等待共享锁\"（删锁即失败）与\"第二批不认领已预留空间\"（去掉 pending 抵扣即失败）；另有**锁覆盖**门禁 the_admission_lock_is_held_while_the_batch_state_is_read——生产路径中的测试钩子在读取引擎状态与回执时探测准入锁是否已被持有，把锁缩小到只包住预留在该测试下失败（已变异验证）。。**锁覆盖缺口已关闭**：原先\"锁只被获取、不覆盖读取段\"的问题由上述覆盖门禁消除（M3 变异现在失败）。**仍存在、未消除的缺口（独立反驳发现）**：①测试直接调用该函数，**不经过生产调用点**（在 `handle_accepted_connection_inner` 中绕过该函数的改动不会被任何测试发现），FileBatchReject/notify/中止会话亦未覆盖；②already_active、is_file_batch_completed、receive_epoch 未被覆盖；③这些均由代码审查保证，不声称受门禁保护。",
  "status": "fixed_gated",
  "pass_condition": "扫描次数与配额合规门禁通过（登记项）；并发准入的三个测试通过，且锁覆盖由覆盖门禁保护；**生产调用点接线、already_active/is_file_batch_completed/receive_epoch 仍仅由代码审查保证**。",
  "reopen_condition": "双批重复认领空间、空间账错误或恢复重复扫描。"
}
