{
  "level": "P2",
  "platform": [
    "shared"
  ],
  "gate": null,
  "ci_job": [],
  "native_acceptance": null,
  "last_verified_main_sha": "b61a0a04b88f5828707f7ef64781389944471be8",
  "id": "S6-P2-1",
  "title": "通知环形缓冲溢出需可检测的 gap/实例标识",
  "code_symbols": [
    "macos/src-tauri/src/api.rs:RuntimeNotificationBuffer"
  ],
  "trigger": "缓冲固定 32 条，客户端落后时中间错误提示被静默丢弃且无告警。",
  "fix_evidence": "未修：RuntimeNotificationBuffer 只有 next_id + entries，无服务实例标识与 gap 提示。",
  "status": "unfixed",
  "pass_condition": "队列覆盖/daemon 重启后客户端明确获知 gap/实例变化并重取快照。",
  "reopen_condition": "漏通知却继续使用旧游标而无提示。"
}
