{
  "level": "P1",
  "platform": [
    "shared"
  ],
  "gate": {
    "kind": "unit",
    "file": "shared/rust-core/src/sync/tests.rs",
    "test": "pending_file_batch_bytes_exclude_partial_data_already_on_disk",
    "command": "cargo test --locked --manifest-path shared/rust-core/Cargo.toml",
    "asserts": "10 字节文件已有 4 字节 .part 时报 26 而非 30（另有 batch_preflight_only_credits_partials_bound_to_the_same_manifest）。"
  },
  "ci_job": [
    "rust-macos",
    "rust-windows"
  ],
  "native_acceptance": null,
  "last_verified_main_sha": "b61a0a04b88f5828707f7ef64781389944471be8",
  "id": "S4-P1-2",
  "title": "续传配额预检扣除已收 .part 前缀，消除双重记账",
  "code_symbols": [
    "shared/rust-core/src/sync/batches.rs",
    "shared/platform-network-server.rs"
  ],
  "trigger": "预检把已收 .part 又计一次全量，满盘时合法续传被拒。",
  "fix_evidence": "预留 = file_batch_remaining_bytes + pending_bytes；只抵扣绑定到同一 manifest 且 sidecar 匹配的 .part。",
  "status": "fixed_gated",
  "pass_condition": "门禁测试在所列平台的 CI job 中以通过状态出现；台账记录该测试名与 job。",
  "reopen_condition": "门禁测试被删除/改名，或其断言的不变量在代码中不再成立。"
}
