{
  "level": "P2",
  "platform": [
    "shared"
  ],
  "gate": null,
  "ci_job": [
    "rust-macos"
  ],
  "native_acceptance": null,
  "last_verified_main_sha": "b61a0a04b88f5828707f7ef64781389944471be8",
  "id": "S6-P2-3",
  "title": "Swift 客户端拒绝非 macOS 的能力响应",
  "code_symbols": [
    "macos/swift-ui/Sources/TailSync/Services/ApiClientRuntime.swift"
  ],
  "trigger": "白名单曾放行 windows，但强制按 macOS 快照解码，看门狗反复杀守护进程。",
  "fix_evidence": "getLocalCapabilities 现要求 capabilities.platform == \"macos\"，旧的 windows 放行已移除。",
  "status": "fixed_ungated",
  "pass_condition": "在 ApiClientCancellationTests.swift 内用 LocalTestSocket 注入 platform:\"windows\" 响应，断言 getLocalCapabilities() 拒绝。",
  "reopen_condition": "非 macOS 平台响应被接受，或看门狗再次因平台不匹配杀进程。"
}
