{
  "level": "P1",
  "platform": [
    "shared"
  ],
  "gate": {
    "kind": "unit",
    "file": "shared/rust-core/src/peer/pool.rs",
    "test": "sender_for_candidates_keeps_a_live_worker_across_route_changes",
    "command": "cargo test --locked --manifest-path shared/rust-core/Cargo.toml",
    "asserts": "改变首选目标会复用缓存 sender（无 shutdown、sender_count==1）并更新候选 watch。"
  },
  "ci_job": [
    "rust-macos",
    "rust-windows"
  ],
  "native_acceptance": null,
  "last_verified_main_sha": "b61a0a04b88f5828707f7ef64781389944471be8",
  "id": "S2-F3",
  "title": "连接池按 hostname 复用 worker，路由微变不再强杀",
  "code_symbols": [
    "shared/rust-core/src/peer/pool.rs:sender_for_candidates"
  ],
  "trigger": "连接池 Key 含动态 Target，后台自省导致首选 IP 微变时旧 worker 被就地处决重传。",
  "fix_evidence": "sender_for_candidates 按 hostname 找在用的 worker 并以 watch 更新候选，不再因重排关闭 worker。",
  "status": "fixed_gated",
  "pass_condition": "门禁测试在所列平台的 CI job 中以通过状态出现；台账记录该测试名与 job。",
  "reopen_condition": "门禁测试被删除/改名，或其断言的不变量在代码中不再成立。"
}
