{
  "level": "P2",
  "platform": [
    "shared"
  ],
  "gate": {
    "kind": "unit",
    "file": "shared/rust-core/src/db/lifecycle.rs",
    "test": "clear_all_reports_removal_failure_and_continues_other_directories",
    "command": "cargo test --locked --manifest-path shared/rust-core/Cargo.toml",
    "asserts": "clear_all 容忍一次 remove_file 失败并继续删除其他目录（未覆盖孤儿对账 GC）。"
  },
  "ci_job": [
    "rust-macos",
    "rust-windows"
  ],
  "native_acceptance": null,
  "last_verified_main_sha": "b61a0a04b88f5828707f7ef64781389944471be8",
  "id": "S5-P2-1",
  "title": "外部文件删除容错与孤儿对账 GC",
  "code_symbols": [
    "shared/rust-core/src/db/lifecycle.rs"
  ],
  "trigger": "DB 提交后删文件遇读写冲突静默留存，且全库缺少对账孤儿扫掠。",
  "fix_evidence": "部分：删除循环改为逐目录 warn/continue，不再级联打断；尚无按 DB 引用对账且带宽限期的孤儿 GC。",
  "status": "partial",
  "pass_condition": "无引用孤儿在宽限期后可清理，活跃或受引用文件均保留，重启后可重试。",
  "reopen_condition": "孤儿过期仍占空间，或误删仍受引用文件。"
}
