{
  "level": "P2",
  "platform": [
    "shared"
  ],
  "gate": {
    "kind": "unit",
    "file": "shared/rust-core/src/sync/tests.rs",
    "test": "expired_transfer_cleanup_removes_orphans_but_preserves_recent_and_nested_files",
    "command": "cargo test --locked --manifest-path shared/rust-core/Cargo.toml",
    "asserts": "清理删除过期明文/.part，保留近期与嵌套受管文件。"
  },
  "ci_job": [
    "rust-macos",
    "rust-windows"
  ],
  "native_acceptance": null,
  "last_verified_main_sha": "b61a0a04b88f5828707f7ef64781389944471be8",
  "id": "S4-P2-2",
  "title": "孤儿 .part 由常驻定时器清理",
  "code_symbols": [
    "shared/platform-clipboard-transfer.rs:run_expired_transfer_maintenance"
  ],
  "trigger": "孤儿 .part 只在启动时清理，进程常驻期间 24 小时内不释放 inode。",
  "fix_evidence": "每 30 分钟运行 run_expired_transfer_maintenance，两端 clipboard.rs 启动该任务。",
  "status": "fixed_gated",
  "pass_condition": "门禁测试在所列平台的 CI job 中以通过状态出现；台账记录该测试名与 job。",
  "reopen_condition": "门禁测试被删除/改名，或其断言的不变量在代码中不再成立。"
}
