{
  "level": "P1",
  "platform": [
    "shared"
  ],
  "gate": {
    "file": "shared/rust-core/src/secure/handshake.rs",
    "test": "window_signal_preserves_a_partially_read_frame",
    "command": "cargo test --locked --manifest-path shared/rust-core/Cargo.toml",
    "asserts": "帧在 header 与 payload 中间被窗口中继打断仍保留命令与载荷。"
  },
  "ci_job": [
    "rust-macos",
    "rust-windows"
  ],
  "native_acceptance": null,
  "last_verified_main_sha": "b61a0a04b88f5828707f7ef64781389944471be8",
  "id": "S3-P1-4",
  "title": "read_pairing_frame 取消安全，不破坏帧边界",
  "code_symbols": [
    "shared/rust-core/src/secure/handshake.rs:read_pairing_frame"
  ],
  "trigger": "select! 在配对窗口信号时打断非取消安全的 read_exact，导致底层流字节错位。",
  "fix_evidence": "用 tokio::pin! 固定 read_plain_frame future 并在 pairing_enabled.changed() 间复用，不再丢弃半读帧。",
  "status": "fixed_gated",
  "pass_condition": "门禁测试在所列平台的 CI job 中以通过状态出现；台账记录该测试名与 job。",
  "reopen_condition": "门禁测试被删除/改名，或其断言的不变量在代码中不再成立。"
}
