{
  "level": "P1",
  "platform": [
    "shared"
  ],
  "gate": {
    "file": "shared/rust-core/src/peer/delivery/tests.rs",
    "test": "race_releases_a_delayed_fallback_when_the_preferred_route_fails_fast",
    "command": "cargo test --locked --manifest-path shared/rust-core/Cargo.toml",
    "asserts": "LAN 快速拒绝时 Tailscale 备选在 <200ms 内胜出，而非等满 300ms。"
  },
  "ci_job": [
    "rust-macos",
    "rust-windows"
  ],
  "native_acceptance": null,
  "last_verified_main_sha": "b61a0a04b88f5828707f7ef64781389944471be8",
  "id": "S2-F4",
  "title": "首选路径快速失败时立即释放被延迟的备用候选",
  "code_symbols": [
    "shared/rust-core/src/peer/delivery/race.rs"
  ],
  "trigger": "未探活候选无条件 sleep 300ms，首选 LAN 1ms 失败仍要等满才能起跑。",
  "fix_evidence": "race.rs 增加 fast_fail watch 通道，首选快速失败即唤醒被延迟的备选。",
  "status": "fixed_gated",
  "pass_condition": "门禁测试在所列平台的 CI job 中以通过状态出现；台账记录该测试名与 job。",
  "reopen_condition": "门禁测试被删除/改名，或其断言的不变量在代码中不再成立。"
}
