{
  "level": "P1",
  "platform": [
    "shared"
  ],
  "gate": {
    "kind": "unit",
    "file": "shared/rust-core/src/peer/delivery/tests.rs",
    "test": "silent_event_ack_ends_the_attempt_instead_of_replaying_on_the_stream",
    "command": "cargo test --locked --manifest-path shared/rust-core/Cargo.toml",
    "asserts": "静默服务端导致可重试 Timeout，线上一帧后不再重放。"
  },
  "ci_job": [
    "rust-macos",
    "rust-windows"
  ],
  "native_acceptance": null,
  "last_verified_main_sha": "b61a0a04b88f5828707f7ef64781389944471be8",
  "id": "S2-F1",
  "title": "静默 ACK 超时不再在同一流上重放导致误判断连",
  "code_symbols": [
    "shared/rust-core/src/peer/delivery/executor.rs",
    "shared/rust-core/src/peer/delivery/worker.rs"
  ],
  "trigger": "重传后残留 ACK 被读流误判为协议错误，连接反复震荡。",
  "fix_evidence": "事件 ACK 超时不再在同一流上重放（重新连接）；心跳改为校验 sequence。",
  "status": "fixed_gated",
  "pass_condition": "门禁测试在所列平台的 CI job 中以通过状态出现；台账记录该测试名与 job。",
  "reopen_condition": "门禁测试被删除/改名，或其断言的不变量在代码中不再成立。"
}
