{
  "level": "P1",
  "platform": [
    "shared"
  ],
  "gate": {
    "file": "shared/tailsync-runtime/src/history.rs",
    "test": "image_payload_rejects_non_image_entries_before_decrypting",
    "command": "cargo test --locked --manifest-path shared/tailsync-runtime/Cargo.toml",
    "asserts": "文本 id 在加载/解密前返回 unsupported_type。"
  },
  "ci_job": [
    "rust-macos",
    "rust-windows"
  ],
  "native_acceptance": null,
  "last_verified_main_sha": "b61a0a04b88f5828707f7ef64781389944471be8",
  "id": "S5-P1-2",
  "title": "图片载荷读取前先校验类型，避免整文件解密进内存",
  "code_symbols": [
    "shared/tailsync-runtime/src/history.rs:image_payload_async"
  ],
  "trigger": "get_image_data 未校验类型即 get_data，持 DB 锁把数 GB 明文装入内存致 OOM。",
  "fix_evidence": "image_payload_async 先查 preview 元数据，非 Image 返回 UnsupportedType；两端调用该路径。",
  "status": "fixed_gated",
  "pass_condition": "门禁测试在所列平台的 CI job 中以通过状态出现；台账记录该测试名与 job。",
  "reopen_condition": "门禁测试被删除/改名，或其断言的不变量在代码中不再成立。"
}
