{
  "level": "P1",
  "platform": [
    "shared"
  ],
  "gate": {
    "kind": "unit",
    "file": "shared/rust-core/src/sync/tests.rs",
    "test": "pending_and_inflight_receives_count_toward_the_peer_limit",
    "command": "cargo test --locked --manifest-path shared/rust-core/Cargo.toml",
    "asserts": "含一 pending 一 inflight 的 Peer 被以 active file receives 拒绝，清空后放行。"
  },
  "ci_job": [
    "rust-macos",
    "rust-windows"
  ],
  "native_acceptance": null,
  "last_verified_main_sha": "b61a0a04b88f5828707f7ef64781389944471be8",
  "id": "S4-P1-1",
  "title": "接收并发限流计入 pending 与 inflight",
  "code_symbols": [
    "shared/rust-core/src/sync/receive_engine.rs:receive_slots_for_peer"
  ],
  "trigger": "限流只查 active，并发 FileMeta 可冲破每 Peer 上限。",
  "fix_evidence": "receive_slots_* 取 active+pending+inflight 的并集，用于两种限流。",
  "status": "fixed_gated",
  "pass_condition": "门禁测试在所列平台的 CI job 中以通过状态出现；台账记录该测试名与 job。",
  "reopen_condition": "门禁测试被删除/改名，或其断言的不变量在代码中不再成立。"
}
